file,line_number,original,replacement
_docs/_releases/home.md,302,Selecting and [defining certain fields as PII fields]({{site.baseurl}}/user_guide/administrative/app_settings/company_settings/security_settings#view-pii) only affects what Users can view on the Braze dashboard and does not impact how the End User data in such PII fields is handled.,Selecting and [defining certain fields as PII fields]({{site.baseurl}}/user_guide/administrative/app_settings/company_settings/security_settings#view-pii) only affects what Users can view on the Braze dashboard and does not impact how the End User data in such PII fields are handled.
_docs/_releases/2022/2_8_22.md,27,Coming soon! Object and object array data type support for custom attributes is arriving in Spring 2022.,Coming soon! Object and object array data type support for custom attributes are arriving in Spring 2022.
_docs/_releases/2025/8_19_25.md,37,Selecting and [defining certain fields as PII fields]({{site.baseurl}}/user_guide/administrative/app_settings/company_settings/security_settings#view-pii) only affects what Users can view on the Braze dashboard and does not impact how the End User data in such PII fields is handled.,Selecting and [defining certain fields as PII fields]({{site.baseurl}}/user_guide/administrative/app_settings/company_settings/security_settings#view-pii) only affects what Users can view on the Braze dashboard and does not impact how the End User data in such PII fields are handled.
_docs/_releases/2024/2_6_24.md,38,Braze CDI support for catalogs is now available for [Databricks sources]({{site.baseurl}}/user_guide/data_and_analytics/cloud_ingestion/sync_catalogs_data/#step-2-integrate-cloud-data-ingestion-with-catalog-data).,Braze CDI support for catalogs are now available for [Databricks sources]({{site.baseurl}}/user_guide/data_and_analytics/cloud_ingestion/sync_catalogs_data/#step-2-integrate-cloud-data-ingestion-with-catalog-data).
_docs/_partners/isv_partners/currents_integration.md,23,"For most error types, (such as server errors, network connection errors, etc.), Braze continues to queue and retry event transmissions for up to 24 hours. After that time, non-transmitted events is dropped. Connectors with consistently poor error rates or uptime is automatically suspended.","For most error types, (such as server errors, network connection errors, etc.), Braze continues to queue and retry event transmissions for up to 24 hours. After that time, non-transmitted events are dropped. Connectors with consistently poor error rates or uptime is automatically suspended."
_docs/_partners/data_and_analytics/cohort_import/treasuredata.md,150,"After running the query, these device IDs is added to the cohort in Braze:","After running the query, these device IDs are added to the cohort in Braze:"
_docs/_partners/data_and_analytics/business_intelligence/looker.md,66,Only existing users is flagged. You cannot use pivoted Looks when flagging data in Braze.,Only existing users are flagged. You cannot use pivoted Looks when flagging data in Braze.
_docs/_partners/data_and_analytics/ab_testing/kameleoon.md,96,"Furthermore, these events is accessible through [Currents custom event objects]({{site.baseurl}}/user_guide/data/distribution/braze_currents/event_glossary/customer_behavior_events/) to allow for comprehensive reporting and analysis.","Furthermore, these events are accessible through [Currents custom event objects]({{site.baseurl}}/user_guide/data/distribution/braze_currents/event_glossary/customer_behavior_events/) to allow for comprehensive reporting and analysis."
_docs/_partners/data_and_analytics/loyalty/punchh/punchh.md,42,"- When utilizing the Braze integration, two campaigns is required, one in Punchh and the second in Braze. For example, if you send a campaign with an offer attached, the gifting campaign is configured within Punchh, and the notification can be sent from Braze.","- When utilizing the Braze integration, two campaigns are required, one in Punchh and the second in Braze. For example, if you send a campaign with an offer attached, the gifting campaign is configured within Punchh, and the notification can be sent from Braze."
_docs/_partners/data_and_analytics/loyalty/punchh/punchh.md,189,"In many cases, Braze campaigns and Canvases being triggered by Punchh events can be set to an ""All Users"" audience since the segmentation of users triggering these events is determined within Punchh. However, customers looking to further refine the audience of users who receives the Braze messaging triggered by the event can do so by adding additional filters and segments in the **Target Audiences** section of the campaign composer or the **Entry Audience** of the Canvas composer. ","In many cases, Braze campaigns and Canvases being triggered by Punchh events can be set to an ""All Users"" audience since the segmentation of users triggering these events are determined within Punchh. However, customers looking to further refine the audience of users who receives the Braze messaging triggered by the event can do so by adding additional filters and segments in the **Target Audiences** section of the campaign composer or the **Entry Audience** of the Canvas composer. "
_docs/_partners/data_and_analytics/customer_data_platform/merkury.md,49,The following fields is populated by Merkury identity connector and need to be created in Braze as [custom attributes]({{site.baseurl}}/user_guide/data_and_analytics/custom_data/custom_attributes#custom-attributes).,The following fields are populated by Merkury identity connector and need to be created in Braze as [custom attributes]({{site.baseurl}}/user_guide/data_and_analytics/custom_data/custom_attributes#custom-attributes).
_docs/_partners/data_and_analytics/customer_data_platform/amperity.md,61,Custom attributes is updated only for those users that have a matching `external_id` or `braze_id` within Braze.,Custom attributes are updated only for those users that have a matching `external_id` or `braze_id` within Braze.
_docs/_partners/data_and_analytics/customer_data_platform/tealium/tealium_for_currents.md,41,"It's important to keep your Tealium URL up to date. If your connector's URL is incorrect, Braze is unable to send events. If this persists for more than **5 days**, the connector's events is dropped, and data is permanently lost.","It's important to keep your Tealium URL up to date. If your connector's URL is incorrect, Braze is unable to send events. If this persists for more than **5 days**, the connector's events are dropped, and data is permanently lost."
_docs/_partners/data_and_analytics/customer_data_platform/tealium/tealium_audience_stream.md,154,"| User attributes | Use existing Braze user profile field names to update user profile values in the Braze dashboard or add your own custom [user attribute]({{site.baseurl}}/api/objects_filters/user_attributes_object/) data to the user profiles.<br><br>- By default, new users is created if one does not exist.<br>- By setting **Update Existing Only** to `true`, only existing users is updated, and no new user is created.<br>- If a Tealium attribute is empty, it is converted to null and removed from the Braze user profile. Enrichments should be used if null values should not be sent to Braze to remove a user attribute. |","| User attributes | Use existing Braze user profile field names to update user profile values in the Braze dashboard or add your own custom [user attribute]({{site.baseurl}}/api/objects_filters/user_attributes_object/) data to the user profiles.<br><br>- By default, new users are created if one does not exist.<br>- By setting **Update Existing Only** to `true`, only existing users are updated, and no new user is created.<br>- If a Tealium attribute is empty, it is converted to null and removed from the Braze user profile. Enrichments should be used if null values should not be sent to Braze to remove a user attribute. |"
_docs/_partners/data_and_analytics/customer_data_platform/tealium/tealium_audience_stream.md,156,"| Event | An event represents a single occurrence of a custom event by a particular user at a timestamp. Use this field to track and map event attributes like those in the Braze [event object]({{site.baseurl}}/api/objects_filters/event_object/). <br><br>- Event attribute `Name` is required for every mapped event.<br>- Event attribute `Time` is automatically set to now unless explicitly mapped. <br>- By default, new events is created if one does not exist. By setting `Update Existing Only` to `true`, only existing events is updated, and no new event is created.<br>-  Map array type attributes to add multiple events. Array type attributes must be of equal length.<br>- Single value attributes can be used and applied to each event. |","| Event | An event represents a single occurrence of a custom event by a particular user at a timestamp. Use this field to track and map event attributes like those in the Braze [event object]({{site.baseurl}}/api/objects_filters/event_object/). <br><br>- Event attribute `Name` is required for every mapped event.<br>- Event attribute `Time` is automatically set to now unless explicitly mapped. <br>- By default, new events are created if one does not exist. By setting `Update Existing Only` to `true`, only existing events are updated, and no new event is created.<br>-  Map array type attributes to add multiple events. Array type attributes must be of equal length.<br>- Single value attributes can be used and applied to each event. |"
_docs/_partners/data_and_analytics/customer_data_platform/tealium/tealium.md,200,"| User attributes | Use existing Braze user profile field names to update user profile values in the Braze dashboard or add your own custom [user attribute]({{site.baseurl}}/api/objects_filters/user_attributes_object/) data to the user profiles.<br><br>- By default, new users is created if one does not exist.<br>- By setting **Update Existing Only** to `true`, only existing users is updated, and no new user is created.<br>- If a Tealium attribute is empty, it is converted to null and removed from the Braze user profile. Enrichments should be used if null values should not be sent to Braze to remove a user attribute. |","| User attributes | Use existing Braze user profile field names to update user profile values in the Braze dashboard or add your own custom [user attribute]({{site.baseurl}}/api/objects_filters/user_attributes_object/) data to the user profiles.<br><br>- By default, new users are created if one does not exist.<br>- By setting **Update Existing Only** to `true`, only existing users are updated, and no new user is created.<br>- If a Tealium attribute is empty, it is converted to null and removed from the Braze user profile. Enrichments should be used if null values should not be sent to Braze to remove a user attribute. |"
_docs/_partners/data_and_analytics/customer_data_platform/tealium/tealium.md,202,"| Event | An event represents a single occurrence of a custom event by a particular user at a timestamp. Use this field to track and map event attributes like those in the Braze [event object]({{site.baseurl}}/api/objects_filters/event_object/). <br><br>- Event attribute `Name` is required for every mapped event.<br>- Event attribute `Time` is automatically set to now unless explicitly mapped. <br>- By default, new events is created if one does not exist. By setting `Update Existing Only` to `true`, only existing events is updated, and no new event is created.<br>-  Map array type attributes to add multiple events. Array type attributes must be of equal length.<br>- Single value attributes can be used and applied to each event. |","| Event | An event represents a single occurrence of a custom event by a particular user at a timestamp. Use this field to track and map event attributes like those in the Braze [event object]({{site.baseurl}}/api/objects_filters/event_object/). <br><br>- Event attribute `Name` is required for every mapped event.<br>- Event attribute `Time` is automatically set to now unless explicitly mapped. <br>- By default, new events are created if one does not exist. By setting `Update Existing Only` to `true`, only existing events are updated, and no new event is created.<br>-  Map array type attributes to add multiple events. Array type attributes must be of equal length.<br>- Single value attributes can be used and applied to each event. |"
_docs/_partners/data_and_analytics/customer_data_platform/segment/segment.md,136,"If the React Native app initializes Braze with the same Braze app identifier for all devices, then all React Native users is considered Android or iOS users in Braze, and all push tokens is associated with that operating system.","If the React Native app initializes Braze with the same Braze app identifier for all devices, then all React Native users are considered Android or iOS users in Braze, and all push tokens are associated with that operating system."
_docs/_partners/data_and_analytics/customer_data_platform/segment/segment.md,195,"| Localization | By default, any SDK-generated user-visible messages is displayed in the user's browser language. Provide a value for this option to override that behavior and force a specific language. The value for this option should be an ISO 639-1 language code. |","| Localization | By default, any SDK-generated user-visible messages are displayed in the user's browser language. Provide a value for this option to override that behavior and force a specific language. The value for this option should be an ISO 639-1 language code. |"
_docs/_partners/data_and_analytics/customer_data_platform/segment/segment_for_currents.md,35,"It's important to keep your Segment write key up to date. If your connector's credentials expire, the connector will stop sending events. If this persists for more than **5 days**, the connector's events is dropped, and data is permanently lost.","It's important to keep your Segment write key up to date. If your connector's credentials expire, the connector will stop sending events. If this persists for more than **5 days**, the connector's events are dropped, and data is permanently lost."
_docs/_partners/data_and_analytics/customer_data_platform/amplitude/amplitude_for_currents.md,51,"Keep your Amplitude API Key up to date. If your connector's credentials expire, the connector will stop sending events. If this persists for more than **48 hours**, the connector's events is dropped, and data is permanently lost.","Keep your Amplitude API Key up to date. If your connector's credentials expire, the connector will stop sending events. If this persists for more than **48 hours**, the connector's events are dropped, and data is permanently lost."
_docs/_partners/data_and_analytics/customer_data_platform/amplitude/amplitude_for_currents.md,56,"In Braze, navigate to **Currents > + Create Current > Create Amplitude Export**. Provide an integration name, contact email, Amplitude export API key, and Amplitude region in the listed fields. Next, select the events you want to track; a list of available events is provided. Lastly, click **Launch Current**","In Braze, navigate to **Currents > + Create Current > Create Amplitude Export**. Provide an integration name, contact email, Amplitude export API key, and Amplitude region in the listed fields. Next, select the events you want to track; a list of available events are provided. Lastly, click **Launch Current**"
_docs/_partners/data_and_analytics/customer_data_platform/treasure_data/treasure_data_for_currents.md,50,"Keep your Treasure Data URL up to date. If your connector’s URL is incorrect, Braze won't be able to send events. If this persists for more than **5 days**, the connector’s events is dropped and data is permanently lost.","Keep your Treasure Data URL up to date. If your connector’s URL is incorrect, Braze won't be able to send events. If this persists for more than **5 days**, the connector’s events are dropped and data is permanently lost."
_docs/_partners/data_and_analytics/customer_data_platform/mParticle/mparticle_for_currents.md,34,"You can think of this as mParticle ingesting a ""feed"" based on each individual app. For example, if you have one app for iOS, one for Android, and one for Web, your events is disjointed. This means if you provide the same credentials for each app, then one mParticle feed is used to receive all data for all of your apps, with no duplication.","You can think of this as mParticle ingesting a ""feed"" based on each individual app. For example, if you have one app for iOS, one for Android, and one for Web, your events are disjointed. This means if you provide the same credentials for each app, then one mParticle feed is used to receive all data for all of your apps, with no duplication."
_docs/_partners/data_and_analytics/customer_data_platform/mParticle/mparticle_for_currents.md,50,"As you create each input, mParticle provides you with a key and secret. Copy these credentials, making sure to note which feed each pair of credentials is for.","As you create each input, mParticle provides you with a key and secret. Copy these credentials, making sure to note which feed each pair of credentials are for."
_docs/_partners/data_and_analytics/customer_data_platform/mParticle/mparticle_for_currents.md,54,"In Braze, navigate to **Currents > + Create Current > Create mParticle Export**. Provide an integration name,  contact email and the mParticle API key and mParticle secret key for each platform. Next, select the events you want to track; a list of available events is provided. Lastly, click **Launch Current**","In Braze, navigate to **Currents > + Create Current > Create mParticle Export**. Provide an integration name,  contact email and the mParticle API key and mParticle secret key for each platform. Next, select the events you want to track; a list of available events are provided. Lastly, click **Launch Current**"
_docs/_partners/data_and_analytics/customer_data_platform/mParticle/mparticle_for_currents.md,59,"It's important to keep your mParticle API Key and mParticle Secret Key up to date; if your connector's credentials expire, the connector will stop sending events. If this persists for more than **5 days**, the connector's events is dropped and data is permanently lost.","It's important to keep your mParticle API Key and mParticle Secret Key up to date; if your connector's credentials expire, the connector will stop sending events. If this persists for more than **5 days**, the connector's events are dropped and data is permanently lost."
_docs/_partners/data_and_analytics/customer_data_platform/mParticle/mparticle.md,152,"| Enable event stream forwarding | (Server-to-server) When enabled, all events is forwarded in real-time. If not, all events is forwarded in bulk. When choosing to enable event stream forwarding, ensure that the data you are passing to Braze will respect [rate limits]({{site.baseurl}}/api/api_limits/). |","| Enable event stream forwarding | (Server-to-server) When enabled, all events are forwarded in real-time. If not, all events are forwarded in bulk. When choosing to enable event stream forwarding, ensure that the data you are passing to Braze will respect [rate limits]({{site.baseurl}}/api/api_limits/). |"
_docs/_partners/data_and_analytics/customer_data_platform/mParticle/mparticle.md,231,"| Purchase commerce event | Purchase event | Purchase commerce events is mapped to Braze purchase events. <br><br>Toggle the setting value for bundle commerce event data to log purchases at the order-level or product-level. For example, if `false`, a single incoming event with two unique products, promotions, or impressions would result in at least two outgoing Braze events. If set to `true`, it would result in a single outgoing event with a nested products, promotions or impressions array, respectively.<br><br>For more information on the additional commerce fields that is logged, see [mParticle's documentation](https://docs.mparticle.com/integrations/braze/event/#purchase-events). <br><br>When setting ""bundle commerce event data"" as `false` product attributes passed to Braze as purchase event properties, support string, numeric, boolean, or date objects but do not support arrays or nested objects.|","| Purchase commerce event | Purchase event | Purchase commerce events are mapped to Braze purchase events. <br><br>Toggle the setting value for bundle commerce event data to log purchases at the order-level or product-level. For example, if `false`, a single incoming event with two unique products, promotions, or impressions would result in at least two outgoing Braze events. If set to `true`, it would result in a single outgoing event with a nested products, promotions or impressions array, respectively.<br><br>For more information on the additional commerce fields that is logged, see [mParticle's documentation](https://docs.mparticle.com/integrations/braze/event/#purchase-events). <br><br>When setting ""bundle commerce event data"" as `false` product attributes passed to Braze as purchase event properties, support string, numeric, boolean, or date objects but do not support arrays or nested objects.|"
_docs/_partners/data_and_analytics/customer_data_platform/mParticle/mparticle.md,232,"| All other commerce events | Custom event | All other commerce events is mapped to custom events. <br><br>Toggle the setting value for bundle commerce event data to log purchases at the order-level or product-level. For example, if `false`, a single incoming event with two unique products, promotions, or impressions would result in at least two outgoing Braze events. If set to `true`, it would result in a single outgoing event with a nested products, promotions or impressions array, respectively.<br><br>In addition to certain default commerce values, product attributes is logged as Braze event properties. For more information on the additional commerce fields that is logged, see [mParticle's documentation](https://docs.mparticle.com/integrations/braze/event/#other-commerce-events)<br><br>When setting ""bundle commerce event data"" as `false` product attributes passed to Braze as event properties, support string, numeric, boolean, or date objects but do not support arrays or nested objects. |","| All other commerce events | Custom event | All other commerce events are mapped to custom events. <br><br>Toggle the setting value for bundle commerce event data to log purchases at the order-level or product-level. For example, if `false`, a single incoming event with two unique products, promotions, or impressions would result in at least two outgoing Braze events. If set to `true`, it would result in a single outgoing event with a nested products, promotions or impressions array, respectively.<br><br>In addition to certain default commerce values, product attributes are logged as Braze event properties. For more information on the additional commerce fields that is logged, see [mParticle's documentation](https://docs.mparticle.com/integrations/braze/event/#other-commerce-events)<br><br>When setting ""bundle commerce event data"" as `false` product attributes passed to Braze as event properties, support string, numeric, boolean, or date objects but do not support arrays or nested objects. |"
_docs/_partners/data_and_analytics/customer_data_platform/mParticle/mparticle.md,239,"- Due to the nature of when MPID is assigned, all users is assigned an `external_id` on session start.","- Due to the nature of when MPID is assigned, all users are assigned an `external_id` on session start."
_docs/_partners/data_and_analytics/analytics/contentsquare.md,51,"Once the integration is complete, Contentsquare custom events is available to use in your campaigns and Canvases. You can check which events are being sent to Braze from **Data Settings** > **Custom Events**.","Once the integration is complete, Contentsquare custom events are available to use in your campaigns and Canvases. You can check which events are being sent to Braze from **Data Settings** > **Custom Events**."
_docs/_partners/data_and_analytics/analytics/mixpanel.md,36,"In your Mixpanel dashboard, click into the **Project Settings** in either a new or existing project. Here you find the Mixpanel API secret and Mixpanel Token. These credentials is used in the next step to create your Currents connection. ","In your Mixpanel dashboard, click into the **Project Settings** in either a new or existing project. Here you find the Mixpanel API secret and Mixpanel Token. These credentials are used in the next step to create your Currents connection. "
_docs/_partners/data_and_analytics/analytics/mixpanel.md,40,"In Braze, navigate to **Currents > **+ Create Current** > **Create Mixpanel Export**. Provide an integration name, contact email, Mixpanel API secret, and Mixpanel token in the listed fields. Next, select the events you want to track; a list of available events is provided. Lastly, click **Launch Current**.","In Braze, navigate to **Currents > **+ Create Current** > **Create Mixpanel Export**. Provide an integration name, contact email, Mixpanel API secret, and Mixpanel token in the listed fields. Next, select the events you want to track; a list of available events are provided. Lastly, click **Launch Current**."
