file,line_number,original,replacement
_docs/_developer_guide/getting_started/sdk_overview.md,84,"You can assign a set of eligible fields to [`configuration.devicePropertyAllowList`](https://braze-inc.github.io/braze-swift-sdk/documentation/brazekit/braze/configuration-swift.class/devicepropertyallowlist) on your `Braze.Configuration` to specify an allowlist for device fields that are collected by the SDK. The full list of fields is defined in [`Braze.Configuration.DeviceProperty`](https://braze-inc.github.io/braze-swift-sdk/documentation/brazekit/braze/configuration-swift.class/deviceproperty). To turn off the collection of all device fields, set the value of this property to an empty set (`[]`).","You can assign a set of eligible fields to [`configuration.devicePropertyAllowList`](https://braze-inc.github.io/braze-swift-sdk/documentation/brazekit/braze/configuration-swift.class/devicepropertyallowlist) on your `Braze.Configuration` to specify an allowlist for device fields that are collected by the SDK. The full list of fields are defined in [`Braze.Configuration.DeviceProperty`](https://braze-inc.github.io/braze-swift-sdk/documentation/brazekit/braze/configuration-swift.class/deviceproperty). To turn off the collection of all device fields, set the value of this property to an empty set (`[]`)."
_docs/_api/endpoints/messaging/send_messages/post_send_messages.md,85,"|`recipient_subscription_state`| Optional | String | Use this to send messages to only users who have opted in (`opted_in`), only users who have subscribed or are opted in (`subscribed`) or to all users, including unsubscribed users (`all`). <br><br>Using `all` users is useful for transactional email messaging. Defaults to `subscribed`. |","|`recipient_subscription_state`| Optional | String | Use this to send messages to only users who have opted in (`opted_in`), only users who have subscribed or are opted in (`subscribed`) or to all users, including unsubscribed users (`all`). <br><br>Using `all` users are useful for transactional email messaging. Defaults to `subscribed`. |"
_docs/_api/endpoints/messaging/send_messages/post_create_send_ids.md,19,Using the send identifier to track and send messages is useful if you are planning to programmatically generate and send content.,Using the send identifier to track and send messages are useful if you are planning to programmatically generate and send content.
_docs/_api/endpoints/messaging/schedule_messages/post_schedule_messages.md,86,"|`recipient_subscription_state`| Optional | String | Use this to send messages to only users who have opted in (`opted_in`), only users who have subscribed or are opted in (`subscribed`) or to all users, including unsubscribed users (`all`). <br><br>Using `all` users is useful for transactional email messaging. Defaults to `subscribed`. |","|`recipient_subscription_state`| Optional | String | Use this to send messages to only users who have opted in (`opted_in`), only users who have subscribed or are opted in (`subscribed`) or to all users, including unsubscribed users (`all`). <br><br>Using `all` users are useful for transactional email messaging. Defaults to `subscribed`. |"
_docs/_user_guide/personalization_and_dynamic_content/liquid/liquid_use_cases.md,1287,"The following use case checks if a web users is on iOS or Android and, if so, will display a specific message.","The following use case checks if a web users are on iOS or Android and, if so, will display a specific message."
_docs/_user_guide/engagement_tools/canvas/canvas_components/experiment_step/personalized_paths.md,17,"- **Single-send Canvas:** A group of users is held back in a delay group. The remaining users pass into an initial test to train a predictive model for a duration you configure—at least 24 hours for best results. After the test, a model is created to learn which user behaviors were associated with a greater likelihood of converting on a given path. Finally, each user in the delay group is sent down the path most likely to result in conversion for them based on the behaviors they exhibit and what the predictive model learned during the initial test.","- **Single-send Canvas:** A group of users are held back in a delay group. The remaining users pass into an initial test to train a predictive model for a duration you configure—at least 24 hours for best results. After the test, a model is created to learn which user behaviors were associated with a greater likelihood of converting on a given path. Finally, each user in the delay group is sent down the path most likely to result in conversion for them based on the behaviors they exhibit and what the predictive model learned during the initial test."
_docs/_user_guide/engagement_tools/canvas/create_a_canvas/exit_criteria.md,84,"2. Three users perform the conversion event within five minutes (the number of exit events is three, and the number of conversion events is three).","2. Three users perform the conversion event within five minutes (the number of exit events are three, and the number of conversion events are three)."
_docs/_user_guide/engagement_tools/testing/global_control_group.md,131,"If two users who have different external user IDs have the same email address, and one of these users is in the control group and the other is not, then an email will still be sent to that email address whenever the non-control group user is eligible for an email. When this occurs, we will mark both user profiles as having received the campaign or Canvas containing that email.","If two users who have different external user IDs have the same email address, and one of these users are in the control group and the other is not, then an email will still be sent to that email address whenever the non-control group user is eligible for an email. When this occurs, we will mark both user profiles as having received the campaign or Canvas containing that email."
_docs/_user_guide/engagement_tools/testing/global_control_group.md,145,"Only one of these segments is active and can be queried using the [`/users/export/global_control_group` endpoint]({{site.baseurl}}/api/endpoints/export/user_data/post_users_global_control_group/), or exported from the dashboard. The export from the dashboard specifically states which subsegments make up this Global Control Group.","Only one of these segments are active and can be queried using the [`/users/export/global_control_group` endpoint]({{site.baseurl}}/api/endpoints/export/user_data/post_users_global_control_group/), or exported from the dashboard. The export from the dashboard specifically states which subsegments make up this Global Control Group."
_docs/_user_guide/engagement_tools/testing/race_conditions.md,13,"> A race condition occurs when an outcome depends on the sequence or timing of multiple events. For example, if the desired sequence of events is “Event A” then “Event B”, but sometimes “Event A” comes first, and other times “Event B” comes first—that is known as a race condition. This can lead to unexpected results or errors because these events compete to access shared resources or data.","> A race condition occurs when an outcome depends on the sequence or timing of multiple events. For example, if the desired sequence of events are “Event A” then “Event B”, but sometimes “Event A” comes first, and other times “Event B” comes first—that is known as a race condition. This can lead to unexpected results or errors because these events compete to access shared resources or data."
_docs/_user_guide/engagement_tools/testing/race_conditions.md,31,"In Braze, one of the most common race conditions occurs with messages that target newly created users. The expected order of events is:","In Braze, one of the most common race conditions occurs with messages that target newly created users. The expected order of events are:"
_docs/_user_guide/engagement_tools/testing/multivariant_testing/ab_test_projection.md,40,"This feature learns from past A/B tests carried out on Braze. The actual copy of your or any Braze customers' messages is never provided to the model. We first extract the high-level language patterns that predict winning messages in A/B tests. Then, we provide those patterns to our AI to teach it to discern which linguistic features constitute superior subject lines.","This feature learns from past A/B tests carried out on Braze. The actual copy of your or any Braze customers' messages are never provided to the model. We first extract the high-level language patterns that predict winning messages in A/B tests. Then, we provide those patterns to our AI to teach it to discern which linguistic features constitute superior subject lines."
_docs/_user_guide/engagement_tools/messaging_fundamentals/approvals.md,75,"To edit a live campaign, you will need the ""Approve and Deny Campaigns"" permission. A user will need to approve their changes since a draft version of campaigns is not yet available. This is not the case for Canvases as a user can make changes and save as a draft, and another user can approve and launch the Canvas.","To edit a live campaign, you will need the ""Approve and Deny Campaigns"" permission. A user will need to approve their changes since a draft version of campaigns are not yet available. This is not the case for Canvases as a user can make changes and save as a draft, and another user can approve and launch the Canvas."
_docs/_user_guide/engagement_tools/messaging_fundamentals/reeligibility.md,42,Re-eligibility for Canvas variants is tied to Canvas entry rather than message receipt. Users who enter a Canvas and don't receive any messages will not be able to re-enter the Canvas unless re-eligibility is turned on.,Re-eligibility for Canvas variants are tied to Canvas entry rather than message receipt. Users who enter a Canvas and don't receive any messages will not be able to re-enter the Canvas unless re-eligibility is turned on.
_docs/_user_guide/engagement_tools/messaging_fundamentals/product_blocks.md,122,"Dynamic product blocks require [eCommerce recommended events]({{site.baseurl}}/ecommerce_events/) and can only be used within [Canvases]({{site.baseurl}}/ecommerce_use_cases). For Braze Shopify users, these events are automatically included as part of the integration. For non-Shopify users, you need to work with your developers to pass these events into Braze and ensure that the primary product identifier within the events is added as the catalog item ID. ","Dynamic product blocks require [eCommerce recommended events]({{site.baseurl}}/ecommerce_events/) and can only be used within [Canvases]({{site.baseurl}}/ecommerce_use_cases). For Braze Shopify users, these events are automatically included as part of the integration. For non-Shopify users, you need to work with your developers to pass these events into Braze and ensure that the primary product identifier within the events are added as the catalog item ID. "
_docs/_user_guide/engagement_tools/messaging_fundamentals/targeting_users.md,14,"> Determining how to target your users is one of the most crucial steps when creating a campaign or Canvas. By understanding how to segment your audience based on their behaviors, preferences and demographics, you can tailor and personalize your messaging.","> Determining how to target your users are one of the most crucial steps when creating a campaign or Canvas. By understanding how to segment your audience based on their behaviors, preferences and demographics, you can tailor and personalize your messaging."
_docs/_user_guide/engagement_tools/campaigns/testing_and_more/sending_test_messages.md,26,"A convenient way to organize your test users is by creating a [Content Test Group]({{site.baseurl}}/user_guide/administrative/app_settings/internal_groups_tab/), which includes a group of users that will receive test messages from campaigns. You can add this test group to the **Add Content Test Groups** field under **Test Recipients** in your campaign, and launch your tests without creating or adding individual test users.","A convenient way to organize your test users are by creating a [Content Test Group]({{site.baseurl}}/user_guide/administrative/app_settings/internal_groups_tab/), which includes a group of users that will receive test messages from campaigns. You can add this test group to the **Add Content Test Groups** field under **Test Recipients** in your campaign, and launch your tests without creating or adding individual test users."
_docs/_user_guide/engagement_tools/segments/segment_insights.md,63,"To improve conversions among speakers of languages other than English, a good first step would be to [localize campaigns]({{site.baseurl}}/user_guide/engagement_tools/campaigns/ideas_and_strategies/campaigns_in_multiple_languages/#campaigns-in-multiple-languages) to the user's device language and making sure that the copy of those messages is engaging users by using a [multivariate campaign]({{site.baseurl}}/user_guide/engagement_tools/campaigns/testing_and_more/multivariate_testing/#creating-tests) to test different versions of the foreign language copy.","To improve conversions among speakers of languages other than English, a good first step would be to [localize campaigns]({{site.baseurl}}/user_guide/engagement_tools/campaigns/ideas_and_strategies/campaigns_in_multiple_languages/#campaigns-in-multiple-languages) to the user's device language and making sure that the copy of those messages are engaging users by using a [multivariate campaign]({{site.baseurl}}/user_guide/engagement_tools/campaigns/testing_and_more/multivariate_testing/#creating-tests) to test different versions of the foreign language copy."
_docs/_user_guide/engagement_tools/segments/measuring_segment_size.md,23,"It is possible that the number of total users is different than the number of users reachable by each channel. In addition, not all channels are listed in the reachable users table. For example, Content Cards, webhooks, and WhatsApp aren't shown in the breakdown. This means that the total reachable users count could be greater than the sum of the users for each displayed channel.","It is possible that the number of total users are different than the number of users reachable by each channel. In addition, not all channels are listed in the reachable users table. For example, Content Cards, webhooks, and WhatsApp aren't shown in the breakdown. This means that the total reachable users count could be greater than the sum of the users for each displayed channel."
_docs/_user_guide/engagement_tools/segments/measuring_segment_size.md,68,"However, it's possible that the number of total users is different than the sum of users reachable by each channel, as a single user may belong to different reachable user groups. For example, a user might have both a valid email address and valid Android push token and be opted in to both, but have no associated iOS push token. ","However, it's possible that the number of total users are different than the sum of users reachable by each channel, as a single user may belong to different reachable user groups. For example, a user might have both a valid email address and valid Android push token and be opted in to both, but have no associated iOS push token. "
_docs/_user_guide/engagement_tools/segments/segment_extension/sql_segments/rfm_segments.md,27,Purchase events must be enabled to use RFM SQL segments because the monetary value for your users is determined by the revenue they’ve generated through Braze purchase events.,Purchase events must be enabled to use RFM SQL segments because the monetary value for your users are determined by the revenue they’ve generated through Braze purchase events.
_docs/_user_guide/administrative/app_settings/internal_groups_tab.md,101,"If you have a recurring campaign and any one of the variants is updated, you can choose to send again to only the updated variants or all variants, or turn off Seed Group sending upon update.","If you have a recurring campaign and any one of the variants are updated, you can choose to send again to only the updated variants or all variants, or turn off Seed Group sending upon update."
_docs/_user_guide/administrative/app_settings/company_settings/security_settings.md,225,"Selecting and defining certain fields as PII fields only affects what Users can view on the Braze dashboard and does not impact how the End User data in such PII fields is handled.<br><br>Consult your legal team to align your dashboard's settings with any privacy regulations and policies applicable to your company, including those related to [data retention]({{site.baseurl}}/data_retention/).","Selecting and defining certain fields as PII fields only affects what Users can view on the Braze dashboard and does not impact how the End User data in such PII fields are handled.<br><br>Consult your legal team to align your dashboard's settings with any privacy regulations and policies applicable to your company, including those related to [data retention]({{site.baseurl}}/data_retention/)."
_docs/_user_guide/administrative/app_settings/company_settings/security_settings.md,260,You are responsible for determining the correct preferences for your workspace. The best way to determine the appropriate settings is to review with internal teams sending events data to Braze and to teams using message extras in Braze to confirm whether the fields may contain PII.  ,You are responsible for determining the correct preferences for your workspace. The best way to determine the appropriate settings are to review with internal teams sending events data to Braze and to teams using message extras in Braze to confirm whether the fields may contain PII.  
_docs/_user_guide/brazeai/predictive_events/analytics.md,60,"Using this information, we encourage you to decide how many of the true positives you want to capture, how many false positives you can accept being targeted, and what the cost of errors is for your business. If you are sending out a valuable promotion, you may want to target only non-purchasers (false positives) by favoring the left side of the chart. Or, you may want to encourage buyers who often purchase (true positives) to do so again by selecting a section of users that favors the right side of the chart.","Using this information, we encourage you to decide how many of the true positives you want to capture, how many false positives you can accept being targeted, and what the cost of errors are for your business. If you are sending out a valuable promotion, you may want to target only non-purchasers (false positives) by favoring the left side of the chart. Or, you may want to encourage buyers who often purchase (true positives) to do so again by selecting a section of users that favors the right side of the chart."
_docs/_user_guide/message_building_by_channel/push/users_and_subscriptions.md,89,"Because a user's decision is final and you can't ask again after they decline, using [push primer]({{site.baseurl}}/user_guide/message_building_by_channel/push/best_practices/push_primer_messages/) in-app messages is an important strategy for increasing your opt-in rates.","Because a user's decision is final and you can't ask again after they decline, using [push primer]({{site.baseurl}}/user_guide/message_building_by_channel/push/best_practices/push_primer_messages/) in-app messages are an important strategy for increasing your opt-in rates."
_docs/_user_guide/message_building_by_channel/email/transactional_message_api_campaign.md,46,The campaign creation flow for Transaction Email campaigns is simplified compared to that of a [standard email campaign]({{site.baseurl}}/user_guide/message_building_by_channel/email/html_editor/creating_an_email_campaign/) to ensure your business-critical transaction email can reach all users.,The campaign creation flow for Transaction Email campaigns are simplified compared to that of a [standard email campaign]({{site.baseurl}}/user_guide/message_building_by_channel/email/html_editor/creating_an_email_campaign/) to ensure your business-critical transaction email can reach all users.
_docs/_user_guide/message_building_by_channel/email/preference_center/dnd_preference_center.md,119,"If an error occurs when a user selects **Save** on a preference center, they will be presented with the following default error message, which cannot be customized or styled in the editor. However, localization of the error messages is still supported on these pages. ","If an error occurs when a user selects **Save** on a preference center, they will be presented with the following default error message, which cannot be customized or styled in the editor. However, localization of the error messages are still supported on these pages. "
_docs/_user_guide/data/activation/catalogs.md,67,"Catalogs are a data storage feature. They contain large sets of data that can be referenced in your messages for personalization. To actually reference the data, you'll use [Liquid]({{site.baseurl}}/user_guide/personalization_and_dynamic_content/liquid/) as the templating language. In other words, catalogs is storage where the data is held, and Liquid is the language that pulls the relevant data from the storage.","Catalogs are a data storage feature. They contain large sets of data that can be referenced in your messages for personalization. To actually reference the data, you'll use [Liquid]({{site.baseurl}}/user_guide/personalization_and_dynamic_content/liquid/) as the templating language. In other words, catalogs are storage where the data is held, and Liquid is the language that pulls the relevant data from the storage."
_docs/_user_guide/data/activation/catalogs.md,73,"Data storage for catalogs is limited based on the size of the catalog items, which may be different from the sizes of uploaded CSV files.","Data storage for catalogs are limited based on the size of the catalog items, which may be different from the sizes of uploaded CSV files."
_docs/_user_guide/data/activation/custom_data/managing_custom_data.md,87,"Blocklisting a high number of events and attributes is possible, but not advisable. This is because each time an event is performed or an attribute is (potentially) sent up to Braze, this event or attribute has to be checked against the entire blocklist.","Blocklisting a high number of events and attributes are possible, but not advisable. This is because each time an event is performed or an attribute is (potentially) sent up to Braze, this event or attribute has to be checked against the entire blocklist."
_docs/_user_guide/data/activation/catalogs/create.md,211,The storage size for the free version of catalogs is up to 100&nbsp;MB. You can have unlimited items as long as they're under 100&nbsp;MB. ,The storage size for the free version of catalogs are up to 100&nbsp;MB. You can have unlimited items as long as they're under 100&nbsp;MB. 
_docs/_user_guide/data/distribution/braze_currents/event_glossary/message_engagement_events.md,10271,This event is created when an RCS messages is sent out of Braze to our last-mile delivery partners.,This event is created when an RCS messages are sent out of Braze to our last-mile delivery partners.
_docs/_user_guide/analytics/reporting/global_control_group_reporting.md,46,"| Conversion Rate | The estimated percentage of users in your control or treatment group that complete your selected event during the time period selected. This is calculated by adding the number of events from the time period and dividing it by the sum of users within the group each day. This can only be approximated because group size fluctuates regularly as new users enter your Global Control Group, and events are total—and not unique—events. If the number of conversions is very small and your control or treatment groups are very large, then the conversion rate may round to 0%. If the number of events is very high—for example, in cases where one user may do more than one event per day—then the conversion rate can be over 100%. | Sum of the number of events for those users over that time period ÷ sum of users in the group each day |","| Conversion Rate | The estimated percentage of users in your control or treatment group that complete your selected event during the time period selected. This is calculated by adding the number of events from the time period and dividing it by the sum of users within the group each day. This can only be approximated because group size fluctuates regularly as new users enter your Global Control Group, and events are total—and not unique—events. If the number of conversions is very small and your control or treatment groups are very large, then the conversion rate may round to 0%. If the number of events are very high—for example, in cases where one user may do more than one event per day—then the conversion rate can be over 100%. | Sum of the number of events for those users over that time period ÷ sum of users in the group each day |"
_docs/_user_guide/getting_started/workspaces.md,50,The aggregation of data across app instances in these filters is why we do not recommend housing substantially different apps within the same workspace. It can make targeting tricky!,The aggregation of data across app instances in these filters are why we do not recommend housing substantially different apps within the same workspace. It can make targeting tricky!
